{
  "providerId": "rust-go.toolchains",
  "category": "runtime",
  "status": "partial",
  "observedAt": "2026-09-21T00:00:00Z",
  "components": [
    {
      "componentId": "rustup",
      "name": "rustup",
      "state": "present",
      "installed": true,
      "activeVersion": {
        "raw": "1.28.2",
        "normalized": "1.28.2",
        "channel": null
      },
      "discoveredVersions": [
        {
          "raw": "1.28.2",
          "normalized": "1.28.2",
          "channel": null
        }
      ],
      "installations": [
        {
          "path": "C:\\Synthetic\\Cargo\\bin\\rustup.exe",
          "version": {
            "raw": "1.28.2",
            "normalized": "1.28.2",
            "channel": null
          },
          "active": true,
          "source": "command"
        }
      ],
      "commandResolutions": [
        {
          "command": "rustup",
          "path": "C:\\Synthetic\\Cargo\\bin\\rustup.exe",
          "commandType": "Application",
          "version": null,
          "precedence": 0,
          "active": true
        }
      ],
      "versionIntelligence": {
        "status": "not-applicable",
        "latestStable": null,
        "latestLts": null,
        "latestCurrent": null,
        "source": null,
        "checkedAt": null,
        "message": null
      }
    },
    {
      "componentId": "rust-toolchains",
      "name": "Rust Toolchains",
      "state": "present",
      "installed": true,
      "activeVersion": null,
      "discoveredVersions": [
        {
          "raw": "1.89.0",
          "normalized": "1.89.0",
          "channel": null
        }
      ],
      "installations": [
        {
          "path": "C:\\Synthetic\\Rustup\\toolchains\\stable-x86_64-pc-windows-msvc",
          "version": null,
          "active": false,
          "source": "environment"
        },
        {
          "path": "C:\\Synthetic\\Rustup\\toolchains\\1.89.0-x86_64-pc-windows-msvc",
          "version": {
            "raw": "1.89.0",
            "normalized": "1.89.0",
            "channel": null
          },
          "active": false,
          "source": "environment"
        }
      ],
      "commandResolutions": [],
      "versionIntelligence": {
        "status": "not-applicable",
        "latestStable": null,
        "latestLts": null,
        "latestCurrent": null,
        "source": null,
        "checkedAt": null,
        "message": null
      }
    },
    {
      "componentId": "rustc",
      "name": "Rust Compiler",
      "state": "partial",
      "installed": true,
      "activeVersion": null,
      "discoveredVersions": [],
      "installations": [
        {
          "path": "C:\\Synthetic\\Cargo\\bin\\rustc.exe",
          "version": null,
          "active": true,
          "source": "command"
        }
      ],
      "commandResolutions": [
        {
          "command": "rustc",
          "path": "C:\\Synthetic\\Cargo\\bin\\rustc.exe",
          "commandType": "Application",
          "version": null,
          "precedence": 0,
          "active": true
        }
      ],
      "versionIntelligence": {
        "status": "not-applicable",
        "latestStable": null,
        "latestLts": null,
        "latestCurrent": null,
        "source": null,
        "checkedAt": null,
        "message": null
      }
    },
    {
      "componentId": "cargo",
      "name": "Cargo",
      "state": "partial",
      "installed": true,
      "activeVersion": null,
      "discoveredVersions": [],
      "installations": [
        {
          "path": "C:\\Synthetic\\Cargo\\bin\\cargo.exe",
          "version": null,
          "active": true,
          "source": "command"
        }
      ],
      "commandResolutions": [
        {
          "command": "cargo",
          "path": "C:\\Synthetic\\Cargo\\bin\\cargo.exe",
          "commandType": "Application",
          "version": null,
          "precedence": 0,
          "active": true
        }
      ],
      "versionIntelligence": {
        "status": "not-applicable",
        "latestStable": null,
        "latestLts": null,
        "latestCurrent": null,
        "source": null,
        "checkedAt": null,
        "message": null
      }
    },
    {
      "componentId": "go",
      "name": "Go",
      "state": "missing",
      "installed": false,
      "activeVersion": null,
      "discoveredVersions": [],
      "installations": [],
      "commandResolutions": [],
      "versionIntelligence": {
        "status": "not-applicable",
        "latestStable": null,
        "latestLts": null,
        "latestCurrent": null,
        "source": null,
        "checkedAt": null,
        "message": null
      }
    }
  ],
  "warnings": [
    {
      "code": "RUSTC_PROXY_NOT_EXECUTED",
      "message": "rustc resolves through rustup, but no active installed toolchain was proven. Version execution was skipped to avoid rustup auto-install side effects.",
      "severity": "warning",
      "componentId": "rustc",
      "evidenceIds": [
        "rust.rustc.version"
      ]
    },
    {
      "code": "CARGO_PROXY_NOT_EXECUTED",
      "message": "cargo resolves through rustup, but no active installed toolchain was proven. Version execution was skipped to avoid rustup auto-install side effects.",
      "severity": "warning",
      "componentId": "cargo",
      "evidenceIds": [
        "rust.cargo.version"
      ]
    },
    {
      "code": "RUSTUP_ACTIVE_TOOLCHAIN_UNPROVEN",
      "message": "rustup toolchains are installed, but none was marked active for the current audit context.",
      "severity": "warning",
      "componentId": "rust-toolchains",
      "evidenceIds": [
        "rust.toolchains"
      ]
    }
  ],
  "errors": [],
  "evidence": [
    {
      "evidenceId": "rust-go.environment",
      "type": "environment",
      "source": "RUSTUP_HOME/CARGO_HOME/GOROOT/GOPATH",
      "exitCode": null,
      "captured": null,
      "redacted": false,
      "attributes": {
        "variables": [
          {
            "name": "RUSTUP_HOME",
            "process": "C:\\Synthetic\\Rustup",
            "user": null,
            "machine": null
          },
          {
            "name": "CARGO_HOME",
            "process": "C:\\Synthetic\\Cargo",
            "user": null,
            "machine": null
          },
          {
            "name": "GOROOT",
            "process": null,
            "user": null,
            "machine": null
          },
          {
            "name": "GOPATH",
            "process": null,
            "user": null,
            "machine": null
          }
        ],
        "rustupHomeConfigured": true,
        "cargoHomeConfigured": true,
        "gorootConfigured": false,
        "gopathConfigured": false
      }
    },
    {
      "evidenceId": "rust.rustup.version",
      "type": "command",
      "source": "rustup --version",
      "exitCode": 0,
      "captured": "rustup 1.28.2",
      "redacted": false,
      "attributes": {
        "status": "success",
        "resolutionCount": 1
      }
    },
    {
      "evidenceId": "rust.toolchains",
      "type": "command",
      "source": "rustup toolchain list",
      "exitCode": 0,
      "captured": "stable-x86_64-pc-windows-msvc (default)\n1.89.0-x86_64-pc-windows-msvc",
      "redacted": false,
      "attributes": {
        "status": "success",
        "toolchainCount": 2,
        "toolchains": [
          {
            "name": "stable-x86_64-pc-windows-msvc",
            "active": false,
            "default": true,
            "channel": "stable",
            "version": null,
            "path": "C:\\Synthetic\\Rustup\\toolchains\\stable-x86_64-pc-windows-msvc"
          },
          {
            "name": "1.89.0-x86_64-pc-windows-msvc",
            "active": false,
            "default": false,
            "channel": null,
            "version": "1.89.0",
            "path": "C:\\Synthetic\\Rustup\\toolchains\\1.89.0-x86_64-pc-windows-msvc"
          }
        ]
      }
    },
    {
      "evidenceId": "rust.rustc.version",
      "type": "command",
      "source": "rustc resolution inspected; version execution skipped for rustup proxy safety",
      "exitCode": null,
      "captured": null,
      "redacted": false,
      "attributes": {
        "executionSkipped": true,
        "resolutionCount": 1
      }
    },
    {
      "evidenceId": "rust.cargo.version",
      "type": "command",
      "source": "cargo resolution inspected; version execution skipped for rustup proxy safety",
      "exitCode": null,
      "captured": null,
      "redacted": false,
      "attributes": {
        "executionSkipped": true,
        "resolutionCount": 1
      }
    },
    {
      "evidenceId": "go.environment",
      "type": "derived",
      "source": "Go CLI not detected; GOROOT/GOPATH command inspection unavailable",
      "exitCode": null,
      "captured": null,
      "redacted": false,
      "attributes": {
        "status": "not-applicable",
        "GOROOT": null,
        "GOPATH": null,
        "rawOutputRetained": false
      }
    }
  ]
}
