{
  "providerId": "dotnet.toolchain",
  "category": "runtime",
  "status": "partial",
  "observedAt": "2026-09-21T00:00:00Z",
  "components": [
    {
      "componentId": "dotnet-sdk",
      "name": ".NET SDK",
      "state": "present",
      "installed": true,
      "activeVersion": {
        "raw": "10.0.100",
        "normalized": "10.0.100",
        "channel": null
      },
      "discoveredVersions": [
        {
          "raw": "10.0.100",
          "normalized": "10.0.100",
          "channel": null
        }
      ],
      "installations": [
        {
          "path": "C:\\Synthetic\\DotNet\\sdk\\10.0.100",
          "version": {
            "raw": "10.0.100",
            "normalized": "10.0.100",
            "channel": null
          },
          "active": true,
          "source": "command"
        }
      ],
      "commandResolutions": [
        {
          "command": "dotnet",
          "path": "C:\\Synthetic\\DotNet\\dotnet.exe",
          "commandType": "Application",
          "version": null,
          "precedence": 0,
          "active": true
        }
      ],
      "versionIntelligence": {
        "status": "not-applicable",
        "latestStable": null,
        "latestLts": null,
        "latestCurrent": null,
        "source": null,
        "checkedAt": null,
        "message": null
      }
    },
    {
      "componentId": "dotnet-runtime",
      "name": ".NET Runtimes",
      "state": "present",
      "installed": true,
      "activeVersion": null,
      "discoveredVersions": [
        {
          "raw": "10.0.0",
          "normalized": "10.0.0",
          "channel": null
        }
      ],
      "installations": [
        {
          "path": "C:\\Synthetic\\DotNet\\shared\\Microsoft.NETCore.App\\10.0.0",
          "version": {
            "raw": "10.0.0",
            "normalized": "10.0.0",
            "channel": null
          },
          "active": false,
          "source": "command"
        }
      ],
      "commandResolutions": [],
      "versionIntelligence": {
        "status": "not-applicable",
        "latestStable": null,
        "latestLts": null,
        "latestCurrent": null,
        "source": null,
        "checkedAt": null,
        "message": null
      }
    },
    {
      "componentId": "dotnet-workloads",
      "name": ".NET Workloads",
      "state": "partial",
      "installed": null,
      "activeVersion": null,
      "discoveredVersions": [],
      "installations": [],
      "commandResolutions": [],
      "versionIntelligence": {
        "status": "not-applicable",
        "latestStable": null,
        "latestLts": null,
        "latestCurrent": null,
        "source": null,
        "checkedAt": null,
        "message": null
      }
    }
  ],
  "warnings": [
    {
      "code": "DOTNET_WORKLOAD_LIST_FAILED",
      "message": "Installed .NET workloads could not be enumerated for the active SDK.",
      "severity": "warning",
      "componentId": "dotnet-workloads",
      "evidenceIds": [
        "dotnet.workloads"
      ]
    }
  ],
  "errors": [],
  "evidence": [
    {
      "evidenceId": "dotnet.environment",
      "type": "environment",
      "source": "DOTNET_ROOT/DOTNET_ROOT_X64/DOTNET_ROOT_X86",
      "exitCode": null,
      "captured": null,
      "redacted": false,
      "attributes": {
        "variables": [
          {
            "name": "DOTNET_ROOT",
            "process": null,
            "user": null,
            "machine": null
          },
          {
            "name": "DOTNET_ROOT_X64",
            "process": null,
            "user": null,
            "machine": null
          },
          {
            "name": "DOTNET_ROOT_X86",
            "process": null,
            "user": null,
            "machine": null
          }
        ],
        "dotnetRootConfigured": false,
        "dotnetRootX64Configured": false,
        "dotnetRootX86Configured": false
      }
    },
    {
      "evidenceId": "dotnet.command-resolution",
      "type": "command",
      "source": "Get-Command dotnet -All",
      "exitCode": null,
      "captured": null,
      "redacted": false,
      "attributes": {
        "resolutionCount": 1,
        "resolutions": [
          {
            "command": "dotnet",
            "path": "C:\\Synthetic\\DotNet\\dotnet.exe",
            "commandType": "Application",
            "version": null,
            "precedence": 0,
            "active": true
          }
        ]
      }
    },
    {
      "evidenceId": "dotnet.version",
      "type": "command",
      "source": "dotnet --version",
      "exitCode": 0,
      "captured": "10.0.100",
      "redacted": false,
      "attributes": {
        "status": "success",
        "timedOut": false,
        "resolutionCount": 1
      }
    },
    {
      "evidenceId": "dotnet.info",
      "type": "command",
      "source": "dotnet --info",
      "exitCode": 0,
      "captured": ".NET SDK:\n Version: 10.0.100\nHost:\n Version: 10.0.0\n Architecture: x64",
      "redacted": false,
      "attributes": {
        "status": "success",
        "timedOut": false
      }
    },
    {
      "evidenceId": "dotnet.sdks",
      "type": "command",
      "source": "dotnet --list-sdks",
      "exitCode": 0,
      "captured": "10.0.100 [C:\\Synthetic\\DotNet\\sdk]",
      "redacted": false,
      "attributes": {
        "status": "success",
        "sdkCount": 1,
        "sdks": [
          {
            "version": "10.0.100",
            "root": "C:\\Synthetic\\DotNet\\sdk",
            "path": "C:\\Synthetic\\DotNet\\sdk\\10.0.100"
          }
        ]
      }
    },
    {
      "evidenceId": "dotnet.runtimes",
      "type": "command",
      "source": "dotnet --list-runtimes",
      "exitCode": 0,
      "captured": "Microsoft.NETCore.App 10.0.0 [C:\\Synthetic\\DotNet\\shared\\Microsoft.NETCore.App]",
      "redacted": false,
      "attributes": {
        "status": "success",
        "runtimeCount": 1,
        "runtimes": [
          {
            "product": "Microsoft.NETCore.App",
            "version": "10.0.0",
            "root": "C:\\Synthetic\\DotNet\\shared\\Microsoft.NETCore.App",
            "path": "C:\\Synthetic\\DotNet\\shared\\Microsoft.NETCore.App\\10.0.0"
          }
        ]
      }
    },
    {
      "evidenceId": "dotnet.workloads",
      "type": "command",
      "source": "dotnet workload list --machine-readable",
      "exitCode": 1,
      "captured": "Workload commands are unavailable for the selected SDK.",
      "redacted": false,
      "attributes": {
        "status": "non-zero",
        "installed": [],
        "installedCount": 0,
        "updateMetadataIgnored": true,
        "rawOutputRetained": true
      }
    }
  ]
}
