{
  "providerId": "rust-go.toolchains",
  "category": "runtime",
  "status": "partial",
  "observedAt": "2026-09-21T00:00:00Z",
  "components": [
    {
      "componentId": "rustup",
      "name": "rustup",
      "state": "partial",
      "installed": true,
      "activeVersion": {
        "raw": "1.27.1",
        "normalized": "1.27.1",
        "channel": null
      },
      "discoveredVersions": [
        {
          "raw": "1.27.1",
          "normalized": "1.27.1",
          "channel": null
        }
      ],
      "installations": [
        {
          "path": "C:\\Synthetic\\Cargo\\bin\\rustup.exe",
          "version": {
            "raw": "1.27.1",
            "normalized": "1.27.1",
            "channel": null
          },
          "active": true,
          "source": "command"
        }
      ],
      "commandResolutions": [
        {
          "command": "rustup",
          "path": "C:\\Synthetic\\Cargo\\bin\\rustup.exe",
          "commandType": "Application",
          "version": null,
          "precedence": 0,
          "active": true
        }
      ],
      "versionIntelligence": {
        "status": "not-applicable",
        "latestStable": null,
        "latestLts": null,
        "latestCurrent": null,
        "source": null,
        "checkedAt": null,
        "message": null
      }
    },
    {
      "componentId": "rust-toolchains",
      "name": "Rust Toolchains",
      "state": "partial",
      "installed": null,
      "activeVersion": null,
      "discoveredVersions": [],
      "installations": [],
      "commandResolutions": [],
      "versionIntelligence": {
        "status": "not-applicable",
        "latestStable": null,
        "latestLts": null,
        "latestCurrent": null,
        "source": null,
        "checkedAt": null,
        "message": null
      }
    },
    {
      "componentId": "rustc",
      "name": "Rust Compiler",
      "state": "partial",
      "installed": true,
      "activeVersion": null,
      "discoveredVersions": [],
      "installations": [
        {
          "path": "C:\\Synthetic\\Cargo\\bin\\rustc.exe",
          "version": null,
          "active": true,
          "source": "command"
        }
      ],
      "commandResolutions": [
        {
          "command": "rustc",
          "path": "C:\\Synthetic\\Cargo\\bin\\rustc.exe",
          "commandType": "Application",
          "version": null,
          "precedence": 0,
          "active": true
        }
      ],
      "versionIntelligence": {
        "status": "not-applicable",
        "latestStable": null,
        "latestLts": null,
        "latestCurrent": null,
        "source": null,
        "checkedAt": null,
        "message": null
      }
    },
    {
      "componentId": "cargo",
      "name": "Cargo",
      "state": "partial",
      "installed": true,
      "activeVersion": null,
      "discoveredVersions": [],
      "installations": [
        {
          "path": "C:\\Synthetic\\Cargo\\bin\\cargo.exe",
          "version": null,
          "active": true,
          "source": "command"
        }
      ],
      "commandResolutions": [
        {
          "command": "cargo",
          "path": "C:\\Synthetic\\Cargo\\bin\\cargo.exe",
          "commandType": "Application",
          "version": null,
          "precedence": 0,
          "active": true
        }
      ],
      "versionIntelligence": {
        "status": "not-applicable",
        "latestStable": null,
        "latestLts": null,
        "latestCurrent": null,
        "source": null,
        "checkedAt": null,
        "message": null
      }
    },
    {
      "componentId": "go",
      "name": "Go",
      "state": "missing",
      "installed": false,
      "activeVersion": null,
      "discoveredVersions": [],
      "installations": [],
      "commandResolutions": [],
      "versionIntelligence": {
        "status": "not-applicable",
        "latestStable": null,
        "latestLts": null,
        "latestCurrent": null,
        "source": null,
        "checkedAt": null,
        "message": null
      }
    }
  ],
  "warnings": [
    {
      "code": "RUSTUP_LEGACY_EXECUTION_SKIPPED",
      "message": "rustup is present, but its version is older than the safe inspection baseline or cannot be verified from executable metadata. CLI execution was skipped to avoid legacy automatic toolchain installation side effects.",
      "severity": "warning",
      "componentId": "rustup",
      "evidenceIds": [
        "rust.rustup.version"
      ]
    },
    {
      "code": "RUSTC_PROXY_NOT_EXECUTED",
      "message": "rustc resolves through rustup, but a safely inspectable active installed toolchain was not proven. Version execution was skipped to avoid rustup auto-install side effects.",
      "severity": "warning",
      "componentId": "rustc",
      "evidenceIds": [
        "rust.rustc.version"
      ]
    },
    {
      "code": "CARGO_PROXY_NOT_EXECUTED",
      "message": "cargo resolves through rustup, but a safely inspectable active installed toolchain was not proven. Version execution was skipped to avoid rustup auto-install side effects.",
      "severity": "warning",
      "componentId": "cargo",
      "evidenceIds": [
        "rust.cargo.version"
      ]
    }
  ],
  "errors": [],
  "evidence": [
    {
      "evidenceId": "rust-go.environment",
      "type": "environment",
      "source": "RUSTUP_HOME/CARGO_HOME/GOROOT/GOPATH",
      "exitCode": null,
      "captured": null,
      "redacted": false,
      "attributes": {
        "variables": [
          {
            "name": "RUSTUP_HOME",
            "process": "C:\\Synthetic\\Rustup",
            "user": null,
            "machine": null
          },
          {
            "name": "CARGO_HOME",
            "process": "C:\\Synthetic\\Cargo",
            "user": null,
            "machine": null
          },
          {
            "name": "GOROOT",
            "process": null,
            "user": null,
            "machine": null
          },
          {
            "name": "GOPATH",
            "process": null,
            "user": null,
            "machine": null
          }
        ],
        "rustupHomeConfigured": true,
        "cargoHomeConfigured": true,
        "gorootConfigured": false,
        "gopathConfigured": false
      }
    },
    {
      "evidenceId": "rust.rustup.version",
      "type": "command",
      "source": "rustup executable metadata; CLI execution skipped for legacy/unknown auto-install safety",
      "exitCode": null,
      "captured": null,
      "redacted": false,
      "attributes": {
        "status": "safety-skipped",
        "resolutionCount": 1,
        "executionSkipped": true,
        "fileMetadataVersion": "1.27.1",
        "minimumSafeInspectionVersion": "1.28.0",
        "autoInstallGuard": null
      }
    },
    {
      "evidenceId": "rust.toolchains",
      "type": "derived",
      "source": "rustup managed-toolchain inspection skipped for legacy/unknown auto-install safety",
      "exitCode": null,
      "captured": null,
      "redacted": false,
      "attributes": {
        "status": "safety-skipped",
        "toolchainCount": 0,
        "toolchains": []
      }
    },
    {
      "evidenceId": "rust.active-toolchain",
      "type": "derived",
      "source": "active rustup toolchain inspection skipped for legacy/unknown auto-install safety",
      "exitCode": null,
      "captured": null,
      "redacted": false,
      "attributes": {
        "status": "safety-skipped",
        "activeToolchain": null,
        "autoInstallGuard": null
      }
    },
    {
      "evidenceId": "rust.rustc.version",
      "type": "command",
      "source": "rustc resolution inspected; version execution skipped for rustup proxy safety",
      "exitCode": null,
      "captured": null,
      "redacted": false,
      "attributes": {
        "executionSkipped": true,
        "resolutionCount": 1
      }
    },
    {
      "evidenceId": "rust.cargo.version",
      "type": "command",
      "source": "cargo resolution inspected; version execution skipped for rustup proxy safety",
      "exitCode": null,
      "captured": null,
      "redacted": false,
      "attributes": {
        "executionSkipped": true,
        "resolutionCount": 1
      }
    },
    {
      "evidenceId": "go.environment",
      "type": "derived",
      "source": "Go CLI not detected; GOROOT/GOPATH command inspection unavailable",
      "exitCode": null,
      "captured": null,
      "redacted": false,
      "attributes": {
        "status": "not-applicable",
        "GOROOT": null,
        "GOPATH": null,
        "rawOutputRetained": false
      }
    }
  ]
}
