{
  "providerId": "developer.clis",
  "category": "runtime",
  "status": "unavailable",
  "observedAt": "2026-09-21T00:00:00Z",
  "components": [
    {
      "componentId": "git",
      "name": "Git",
      "state": "missing",
      "installed": false,
      "activeVersion": null,
      "discoveredVersions": [],
      "installations": [],
      "commandResolutions": [],
      "versionIntelligence": {
        "status": "not-applicable",
        "latestStable": null,
        "latestLts": null,
        "latestCurrent": null,
        "source": null,
        "checkedAt": null,
        "message": null
      }
    },
    {
      "componentId": "github-cli",
      "name": "GitHub CLI",
      "state": "missing",
      "installed": false,
      "activeVersion": null,
      "discoveredVersions": [],
      "installations": [],
      "commandResolutions": [],
      "versionIntelligence": {
        "status": "not-applicable",
        "latestStable": null,
        "latestLts": null,
        "latestCurrent": null,
        "source": null,
        "checkedAt": null,
        "message": null
      }
    },
    {
      "componentId": "docker",
      "name": "Docker CLI",
      "state": "missing",
      "installed": false,
      "activeVersion": null,
      "discoveredVersions": [],
      "installations": [],
      "commandResolutions": [],
      "versionIntelligence": {
        "status": "not-applicable",
        "latestStable": null,
        "latestLts": null,
        "latestCurrent": null,
        "source": null,
        "checkedAt": null,
        "message": null
      }
    },
    {
      "componentId": "supabase-cli",
      "name": "Supabase CLI",
      "state": "missing",
      "installed": false,
      "activeVersion": null,
      "discoveredVersions": [],
      "installations": [],
      "commandResolutions": [],
      "versionIntelligence": {
        "status": "not-applicable",
        "latestStable": null,
        "latestLts": null,
        "latestCurrent": null,
        "source": null,
        "checkedAt": null,
        "message": null
      }
    },
    {
      "componentId": "vercel-cli",
      "name": "Vercel CLI",
      "state": "missing",
      "installed": false,
      "activeVersion": null,
      "discoveredVersions": [],
      "installations": [],
      "commandResolutions": [],
      "versionIntelligence": {
        "status": "not-applicable",
        "latestStable": null,
        "latestLts": null,
        "latestCurrent": null,
        "source": null,
        "checkedAt": null,
        "message": null
      }
    },
    {
      "componentId": "heroku-cli",
      "name": "Heroku CLI",
      "state": "missing",
      "installed": false,
      "activeVersion": null,
      "discoveredVersions": [],
      "installations": [],
      "commandResolutions": [],
      "versionIntelligence": {
        "status": "not-applicable",
        "latestStable": null,
        "latestLts": null,
        "latestCurrent": null,
        "source": null,
        "checkedAt": null,
        "message": null
      }
    },
    {
      "componentId": "docker-compose",
      "name": "Docker Compose",
      "state": "missing",
      "installed": false,
      "activeVersion": null,
      "discoveredVersions": [],
      "installations": [],
      "commandResolutions": [],
      "versionIntelligence": {
        "status": "not-applicable",
        "latestStable": null,
        "latestLts": null,
        "latestCurrent": null,
        "source": null,
        "checkedAt": null,
        "message": null
      }
    }
  ],
  "warnings": [],
  "errors": [],
  "evidence": [
    {
      "evidenceId": "developer.safety-boundary",
      "type": "derived",
      "source": "developer CLI audit boundary",
      "exitCode": null,
      "captured": null,
      "redacted": false,
      "attributes": {
        "authenticationStateCollected": false,
        "accountStateCollected": false,
        "gitConfigurationCollected": false,
        "dockerDaemonInspected": false,
        "dockerContextsCollected": false,
        "servicesStartedOrStopped": false
      }
    }
  ]
}
